{"cutover":{"commit":"b5091e7afe26a19e5de6a00e03d77e4231f1aed7","started_at":"2026-07-30T20:27:22+08:00"},"fingerprint_version":"v1","input_digest":"sha256:3a213fd64a31a032da300e35e8a7542a90befeef8905afb0628894d62a299803","issues":[{"event_count":5,"event_ids":["FE-11878a8d3fb81fdbe43169b4","FE-1618f7e7d64b3de59a054f43","FE-c34db69d57dd2887ee2511ef","FE-d013e35642d0a06229350a96","FE-eed95ca7fd5399e04f2067eb"],"event_paths":["records/T0163-0731-nbu-dte-enforced-mechanism/flow-events/FE-11878a8d3fb81fdbe43169b4.json","records/T0163-0731-nbu-dte-enforced-mechanism/flow-events/FE-c34db69d57dd2887ee2511ef.json","records/T0163/flow-events/FE-1618f7e7d64b3de59a054f43.json","records/T0163/flow-events/FE-d013e35642d0a06229350a96.json","records/T0163/flow-events/FE-eed95ca7fd5399e04f2067eb.json"],"fingerprint":{"affected_component":"scripts.transition-phase","category":"conformance-deviation","fingerprint_version":"v1","issue_code":"ACCEPTANCE_CRITERIA_MISSING","normalized_location":"audit/acceptance_criteria_missing-6e412141465c0151","rule_id":"transition-audit","rule_version":"v2","transition":"do-to-check"},"first_occurred_at":"2026-07-31T11:21:13+08:00","issue_id":"FI-b0dd12fad12b26e3c6c1fd8a","last_occurred_at":"2026-07-31T11:21:50+08:00","record_ids":["T0163","T0163-0731-nbu-dte-enforced-mechanism"],"sources":["transition-audit"]},{"event_count":4,"event_ids":["FE-19df2b49222fb9f89c48dd54","FE-64c2b018cbdf4cc380e346f1","FE-82e9b24d5544311338e5d3fc","FE-9444fd347f909e053a91cea8"],"event_paths":["records/T0163-0731-nbu-dte-enforced-mechanism/flow-events/FE-19df2b49222fb9f89c48dd54.json","records/T0163-0731-nbu-dte-enforced-mechanism/flow-events/FE-64c2b018cbdf4cc380e346f1.json","records/T0163-0731-nbu-dte-enforced-mechanism/flow-events/FE-82e9b24d5544311338e5d3fc.json","records/T0163-0731-nbu-dte-enforced-mechanism/flow-events/FE-9444fd347f909e053a91cea8.json"],"fingerprint":{"affected_component":"scripts.transition-phase","category":"conformance-deviation","fingerprint_version":"v1","issue_code":"ACCEPTANCE_CRITERION_UNCOVERED","normalized_location":"audit/acceptance_criterion_uncovered-721898da8f7364e3","rule_id":"transition-audit","rule_version":"v2","transition":"do-to-check"},"first_occurred_at":"2026-07-31T11:22:11+08:00","issue_id":"FI-1eb777dd97d9630a5d9e3a03","last_occurred_at":"2026-07-31T11:22:58+08:00","record_ids":["T0163-0731-nbu-dte-enforced-mechanism"],"sources":["transition-audit"]},{"event_count":3,"event_ids":["FE-31400c56a808d968992f87b3","FE-ba164d575dfa4ecd5d5e1f80","FE-dcf9ec91bfe3e543e82a01dd"],"event_paths":["records/T0163/flow-events/FE-31400c56a808d968992f87b3.json","records/T0163/flow-events/FE-ba164d575dfa4ecd5d5e1f80.json","records/T0163/flow-events/FE-dcf9ec91bfe3e543e82a01dd.json"],"fingerprint":{"affected_component":"scripts.transition-phase","category":"conformance-deviation","fingerprint_version":"v1","issue_code":"AC_COVERAGE_UNVERIFIABLE","normalized_location":"audit/ac_coverage_unverifiable-836e7df6965a5126","rule_id":"transition-audit","rule_version":"v2","transition":"do-to-check"},"first_occurred_at":"2026-07-31T11:21:13+08:00","issue_id":"FI-3f4b5486bac9e4d4c6d96e0d","last_occurred_at":"2026-07-31T11:21:36+08:00","record_ids":["T0163"],"sources":["transition-audit"]},{"event_count":3,"event_ids":["FE-3ce495dc8a1e95fcd957d4e4","FE-47a938a5a4d26b666e04186d","FE-fb2990bc1ca2216d0757a45b"],"event_paths":["records/T0163/flow-events/FE-3ce495dc8a1e95fcd957d4e4.json","records/T0163/flow-events/FE-47a938a5a4d26b666e04186d.json","records/T0163/flow-events/FE-fb2990bc1ca2216d0757a45b.json"],"fingerprint":{"affected_component":"scripts.transition-phase","category":"conformance-deviation","fingerprint_version":"v1","issue_code":"EVIDENCE_INTEGRITY_UNVERIFIABLE","normalized_location":"audit/evidence_integrity_unverifiable-836e7df6965a5126","rule_id":"transition-audit","rule_version":"v2","transition":"do-to-check"},"first_occurred_at":"2026-07-31T11:21:13+08:00","issue_id":"FI-57217a2a8488aad19e411e62","last_occurred_at":"2026-07-31T11:21:36+08:00","record_ids":["T0163"],"sources":["transition-audit"]},{"event_count":3,"event_ids":["FE-098c05f831d2dd5196fb362d","FE-29dc715fed3b333b3498ad6d","FE-4cbd61b7d40b2a60790bca40"],"event_paths":["records/T0163/flow-events/FE-098c05f831d2dd5196fb362d.json","records/T0163/flow-events/FE-29dc715fed3b333b3498ad6d.json","records/T0163/flow-events/FE-4cbd61b7d40b2a60790bca40.json"],"fingerprint":{"affected_component":"scripts.transition-phase","category":"conformance-deviation","fingerprint_version":"v1","issue_code":"RECORD_MISSING","normalized_location":"audit/record_missing-836e7df6965a5126","rule_id":"transition-audit","rule_version":"v2","transition":"do-to-check"},"first_occurred_at":"2026-07-31T11:21:13+08:00","issue_id":"FI-98e9944c9e3bf6edadcaf9de","last_occurred_at":"2026-07-31T11:21:36+08:00","record_ids":["T0163"],"sources":["transition-audit"]},{"event_count":3,"event_ids":["FE-421f90e024fd4d9ad170bb0b","FE-643b04ef5af937ef46c227fb","FE-acfd530f9fdf2aeb92bf346b"],"event_paths":["records/T0163/flow-events/FE-421f90e024fd4d9ad170bb0b.json","records/T0163/flow-events/FE-643b04ef5af937ef46c227fb.json","records/T0163/flow-events/FE-acfd530f9fdf2aeb92bf346b.json"],"fingerprint":{"affected_component":"scripts.transition-phase","category":"conformance-deviation","fingerprint_version":"v1","issue_code":"CONVERGENCE_MAP_MISSING","normalized_location":"audit/convergence_map_missing-836e7df6965a5126","rule_id":"transition-audit","rule_version":"v2","transition":"do-to-check"},"first_occurred_at":"2026-07-31T11:21:13+08:00","issue_id":"FI-f4cca1595e55684e4129133d","last_occurred_at":"2026-07-31T11:21:36+08:00","record_ids":["T0163"],"sources":["transition-audit"]},{"event_count":2,"event_ids":["FE-2cb086e527df494295e078a8","FE-dc0216a6f69db702a6230253"],"event_paths":["records/T0163-0731-nbu-dte-enforced-mechanism/flow-events/FE-2cb086e527df494295e078a8.json","records/T0163-0731-nbu-dte-enforced-mechanism/flow-events/FE-dc0216a6f69db702a6230253.json"],"fingerprint":{"affected_component":"scripts.transition-phase","category":"conformance-deviation","fingerprint_version":"v1","issue_code":"CONVERGENCE_CRITERION_UNKNOWN","normalized_location":"audit/convergence_criterion_unknown-38628e9ee1a0e20e","rule_id":"transition-audit","rule_version":"v2","transition":"do-to-check"},"first_occurred_at":"2026-07-31T11:21:43+08:00","issue_id":"FI-179e05902b274644cf3c7ffb","last_occurred_at":"2026-07-31T11:21:50+08:00","record_ids":["T0163-0731-nbu-dte-enforced-mechanism"],"sources":["transition-audit"]},{"event_count":2,"event_ids":["FE-5b1271ab1d2cf9f68dced15d","FE-d9a78ceecd558b340ec6a0a0"],"event_paths":["records/T0163-0731-nbu-dte-enforced-mechanism/flow-events/FE-5b1271ab1d2cf9f68dced15d.json","records/T0163-0731-nbu-dte-enforced-mechanism/flow-events/FE-d9a78ceecd558b340ec6a0a0.json"],"fingerprint":{"affected_component":"scripts.transition-phase","category":"conformance-deviation","fingerprint_version":"v1","issue_code":"CONVERGENCE_CRITERION_UNKNOWN","normalized_location":"audit/convergence_criterion_unknown-a9a8884728270dbb","rule_id":"transition-audit","rule_version":"v2","transition":"do-to-check"},"first_occurred_at":"2026-07-31T11:21:43+08:00","issue_id":"FI-382683523a85dc6a804c7943","last_occurred_at":"2026-07-31T11:21:50+08:00","record_ids":["T0163-0731-nbu-dte-enforced-mechanism"],"sources":["transition-audit"]},{"event_count":2,"event_ids":["FE-43b0f5a86ed2aa1976a50314","FE-a9dd5cc619949a607c8e6c25"],"event_paths":["records/T0163-0731-nbu-dte-enforced-mechanism/flow-events/FE-43b0f5a86ed2aa1976a50314.json","records/T0163-0731-nbu-dte-enforced-mechanism/flow-events/FE-a9dd5cc619949a607c8e6c25.json"],"fingerprint":{"affected_component":"scripts.transition-phase","category":"conformance-deviation","fingerprint_version":"v1","issue_code":"CONVERGENCE_CRITERION_UNKNOWN","normalized_location":"audit/convergence_criterion_unknown-e5e4854847db3d29","rule_id":"transition-audit","rule_version":"v2","transition":"do-to-check"},"first_occurred_at":"2026-07-31T11:21:43+08:00","issue_id":"FI-7f0e8377f52e4c8247ed9d81","last_occurred_at":"2026-07-31T11:21:50+08:00","record_ids":["T0163-0731-nbu-dte-enforced-mechanism"],"sources":["transition-audit"]},{"event_count":2,"event_ids":["FE-9db30ee9956dae6634d92822","FE-ec209b64a548a9aa3ceda2f3"],"event_paths":["records/T0163-0731-nbu-dte-enforced-mechanism/flow-events/FE-9db30ee9956dae6634d92822.json","records/T0163-0731-nbu-dte-enforced-mechanism/flow-events/FE-ec209b64a548a9aa3ceda2f3.json"],"fingerprint":{"affected_component":"scripts.transition-phase","category":"conformance-deviation","fingerprint_version":"v1","issue_code":"CONVERGENCE_CRITERION_UNKNOWN","normalized_location":"audit/convergence_criterion_unknown-6e34be301845ea07","rule_id":"transition-audit","rule_version":"v2","transition":"do-to-check"},"first_occurred_at":"2026-07-31T11:21:43+08:00","issue_id":"FI-ad8d38e24b17f9ced614d883","last_occurred_at":"2026-07-31T11:21:50+08:00","record_ids":["T0163-0731-nbu-dte-enforced-mechanism"],"sources":["transition-audit"]},{"event_count":2,"event_ids":["FE-511bb415d3b9b4b9ddca29d0","FE-c7b61b797e3b6b7d0b881f18"],"event_paths":["records/T0163-0731-nbu-dte-enforced-mechanism/flow-events/FE-511bb415d3b9b4b9ddca29d0.json","records/T0163-0731-nbu-dte-enforced-mechanism/flow-events/FE-c7b61b797e3b6b7d0b881f18.json"],"fingerprint":{"affected_component":"scripts.transition-phase","category":"conformance-deviation","fingerprint_version":"v1","issue_code":"CONVERGENCE_CRITERION_UNKNOWN","normalized_location":"audit/convergence_criterion_unknown-a42bf69194cadbfb","rule_id":"transition-audit","rule_version":"v2","transition":"do-to-check"},"first_occurred_at":"2026-07-31T11:21:43+08:00","issue_id":"FI-e9d02d91633eaaf56edece62","last_occurred_at":"2026-07-31T11:21:50+08:00","record_ids":["T0163-0731-nbu-dte-enforced-mechanism"],"sources":["transition-audit"]},{"event_count":1,"event_ids":["FE-c059fe399df2979772ce9b83"],"event_pat